"PatternId_decimal",description,"killchain_stage",name,objective,"pattern_updated",scenario,scenarioFriendly,severity,"show_in_ui",tactic,technique
7554,"MICRO BEHAVIOR: General Rollup for System Profiler MBs",Unknown,,"N/A","1665167124.0","micro_behavior","Process micro behavior",10,False,,
7555,"MICRO BEHAVIOR: Process queried Apple Pay information from system profiler",Unknown,,"N/A","1665167124.0","micro_behavior","Process micro behavior",10,False,,
7547,"MICRO BEHAVIOR: Process queried USB data from system profiler",Unknown,,"N/A","1665167123.0","micro_behavior","Process micro behavior",10,False,,
7557,"MICRO BEHAVIOR: Process wrote a file with .iso or .img extension.",Unknown,,"N/A","1666031421.0","micro_behavior","Process micro behavior",10,False,,
7556,"MICROBEHAVIOR: A process opened a handle with an unsafe access mask to msiexec.exe.",Unknown,,"N/A","1669400724.0","micro_behavior","Process micro behavior",10,False,,
7559,"MICRO BEHAVIOR: Process flushed the CSRSS activation context cache by creating 256 (or more) activation contexts in a short period of time.",Unknown,,"N/A","1666722321.0","micro_behavior","Process micro behavior",10,False,,
7558,"MICRO BEHAVIOR: A process looked up the Kerberos framework path",Unknown,,"N/A","1666290622.0","micro_behavior","Process micro behavior",10,False,,
7553,"MICRO BEHAVIOR: Process queried startup applications from system profiler",Unknown,,"N/A","1665167124.0","micro_behavior","Process micro behavior",10,False,,
7560,"MICRO BEHAVIOR: Process deleted a file's extended attribute.",Unknown,,"N/A","1667240722.0","micro_behavior","Process micro behavior",10,False,,
7561,"MICRO BEHAVIOR: An application user logged in to system",Unknown,,"N/A","1671129322.0","micro_behavior","Process micro behavior",10,False,,
7564,"MICRO BEHAVIOR: Process copied itself to another location.",Unknown,,"N/A","1673374672.0","micro_behavior","Process micro behavior",10,False,,
7562,"MICRO BEHAVIOR: The LD_PRELOAD has a path containing /www/.",Unknown,,"N/A","1669152326.0","micro_behavior","Process micro behavior",10,False,,
7563,"MICRO BEHAVIOR: File renamed with a new extension inside the recycle bin.",Unknown,,"N/A","1670264724.0","micro_behavior","Process micro behavior",10,False,,
7565,"MICRO BEHAVIOR: curl or wget were used to access a url containing iam/security-credential/",Unknown,,"N/A","1669152326.0","micro_behavior","Process micro behavior",10,False,,
7566,"MICRO BEHAVIOR: A process created a web script file, such as ASPX or PHP.",Unknown,,"N/A","1671215424.0","micro_behavior","Process micro behavior",10,False,,
7567,"Generic MB rollup for icon file lookups.",Unknown,,"N/A","1669746619.0","micro_behavior","Process micro behavior",10,False,,
7568,"A process opened an icon file in the System directory.",Unknown,,"N/A","1669746619.0","micro_behavior","Process micro behavior",10,False,,
7569,"A process opened an icon file used by MacOS Software Update",Unknown,,"N/A","1669746619.0","micro_behavior","Process micro behavior",10,False,,
7570,"A process opened an icon file from the Zoom app.",Unknown,,"N/A","1669746619.0","micro_behavior","Process micro behavior",10,False,,
7571,"A process opened an icon file from the Chrome app.",Unknown,,"N/A","1669746619.0","micro_behavior","Process micro behavior",10,False,,
7572,"A process opened an icon file from the Safari app.",Unknown,,"N/A","1669746619.0","micro_behavior","Process micro behavior",10,False,,
7573,"A process opened an icon file from the Terminal app.",Unknown,,"N/A","1669746620.0","micro_behavior","Process micro behavior",10,False,,
7574,"A process opened an icon file from the Falcon app.",Unknown,,"N/A","1669746620.0","micro_behavior","Process micro behavior",10,False,,
7575,"A process opened an icon file from the VMware Fusion app.",Unknown,,"N/A","1669746620.0","micro_behavior","Process micro behavior",10,False,,
7576,"MICRO BEHAVIOR: Service Control Manager being used to disable (stop) a service",Unknown,,"N/A","1671820519.0","micro_behavior","Process micro behavior",10,False,,
7582,"MICRO BEHAVIOR: A file which was being used by kubelet as a configuration file was modified. This could be an attempt to hijack a kubernetes node.",Unknown,,"N/A","1675189223.0","micro_behavior","Process micro behavior",35,False,,
7583,"A process opened a handle with terminate mask to msiexec. Msiexec terminated soon after the handle was opened.",Unknown,,"N/A","1671647425.0","micro_behavior","Process micro behavior",10,False,,
7584,"A file with an extension matching common cert file extensions was created.",Unknown,,"N/A","1672857318.0","micro_behavior","Process micro behavior",10,False,,
7585,"A file with an extension matching common cert file extensions was opened.",Unknown,,"N/A","1672857318.0","micro_behavior","Process micro behavior",10,False,,
7586,"A file with an extension matching common cert file extensions was renamed.",Unknown,,"N/A","1672857319.0","micro_behavior","Process micro behavior",10,False,,
7587,"MICRO BEHAVIOR: A process spawned many recon commands in a short period of time",Unknown,,"N/A","1676312422.0","micro_behavior","Process micro behavior",10,False,,
7588,"MICRO BEHAVIOR: A process spawned whoami.exe",Unknown,,"N/A","1676312422.0","micro_behavior","Process micro behavior",10,False,,
7589,"MICRO BEHAVIOR: A process spawned fsutil.exe",Unknown,,"N/A","1676312422.0","micro_behavior","Process micro behavior",10,False,,
7590,"MICRO BEHAVIOR: A process spawned net.exe",Unknown,,"N/A","1676312422.0","micro_behavior","Process micro behavior",10,False,,
7592,"MICRO BEHAVIOR: A process spawned ftp.exe",Unknown,,"N/A","1676312422.0","micro_behavior","Process micro behavior",10,False,,
7591,"MICRO BEHAVIOR: A process spawned taskkill.exe",Unknown,,"N/A","1676312422.0","micro_behavior","Process micro behavior",10,False,,
7593,"MICRO BEHAVIOR: A process spawned curl.exe",Unknown,,"N/A","1676312422.0","micro_behavior","Process micro behavior",10,False,,
7594,"MICRO BEHAVIOR: This process loaded the library wow64log.dll.",Unknown,,"N/A","1670956823.0","micro_behavior","Process micro behavior",10,False,,
7595,"A process exploited the dirty pipe vulnerability.",Unknown,,"N/A","1673646329.0","micro_behavior","Process micro behavior",10,False,,
7596,"MICRO BEHAVIOR: A process spawned netsh.exe",Unknown,,"N/A","1676312422.0","micro_behavior","Process micro behavior",10,False,,
7597,"MICRO BEHAVIOR: A process spawned nltest.exe",Unknown,,"N/A","1676312422.0","micro_behavior","Process micro behavior",10,False,,
7598,"MICRO BEHAVIOR: A process spawned systeminfo.exe",Unknown,,"N/A","1676312423.0","micro_behavior","Process micro behavior",10,False,,
7599,"MICRO BEHAVIOR: A process spawned ping.exe",Unknown,,"N/A","1676312423.0","micro_behavior","Process micro behavior",10,False,,
7600,"MICRO BEHAVIOR: A process spawned schtasks.exe",Unknown,,"N/A","1676312423.0","micro_behavior","Process micro behavior",10,False,,
7601,"A process opened a file associated with Microsoft Teams that contains credential data.",Unknown,,"N/A","1671560722.0","micro_behavior","Process micro behavior",10,False,,
7603,"MICRO BEHAVIOR: A process spawned at.exe",Unknown,,"N/A","1676312423.0","micro_behavior","Process micro behavior",10,False,,
7602,"MICRO BEHAVIOR: A process spawned sc.exe",Unknown,,"N/A","1676312423.0","micro_behavior","Process micro behavior",10,False,,
7606,"MICRO BEHAVIOR: kernel32 in this process was patched by a remote process. Possible hook bypass.",Unknown,,"N/A","1674238820.0","micro_behavior","Process micro behavior",10,False,,
7604,"MICRO BEHAVIOR: A process created a Registry symbolic link.",Unknown,,"N/A","1671647425.0","micro_behavior","Process micro behavior",10,False,,
7605,"MICRO BEHAVIOR: ntdll in this process was patched by a remote process. Possible hook bypass.",Unknown,,"N/A","1674238820.0","micro_behavior","Process micro behavior",10,False,,
7607,"MICRO BEHAVIOR: This process loaded ntdll.dll from SysWOW64 directory, which is an indicator of a 32-bit process executing in a 64-bit environment.",Unknown,,"N/A","1674152422.0","micro_behavior","Process micro behavior",10,False,,
7608,"MICRO BEHAVIOR: This process performed a low number of file deletions.",Unknown,,"N/A","1674066320.0","micro_behavior","Process micro behavior",10,False,,
7609,"MICRO BEHAVIOR: This process performed a medium number of file deletions.",Unknown,,"N/A","1674066320.0","micro_behavior","Process micro behavior",10,False,,
7610,"MICRO BEHAVIOR: This process performed a high number of file deletions.",Unknown,,"N/A","1674066320.0","micro_behavior","Process micro behavior",10,False,,
7611,"MICRO BEHAVIOR: This process performed a low number of file deletions in the Recycle Bin.",Unknown,,"N/A","1674066320.0","micro_behavior","Process micro behavior",10,False,,
7613,"MICRO BEHAVIOR: This process performed a high number of file deletions in the Recycle Bin.",Unknown,,"N/A","1674066321.0","micro_behavior","Process micro behavior",10,False,,
7612,"MICRO BEHAVIOR: This process performed a medium number of file deletions in the Recycle Bin.",Unknown,,"N/A","1674066320.0","micro_behavior","Process micro behavior",10,False,,
7614,"MICRO BEHAVIOR: A process wrote to the known_hosts file in the .ssh directory.",Unknown,,"N/A","1674671418.0","micro_behavior","Process micro behavior",10,False,,
7616,"MICRO BEHAVIOR: A process accessed a file associated with Slack containing information on downloads from Slack.",Unknown,,"N/A","1674498028.0","micro_behavior","Process micro behavior",10,False,,
7615,"MICRO BEHAVIOR: A process accessed a file associated with Slack containing information on Slack workspaces.",Unknown,,"N/A","1674498028.0","micro_behavior","Process micro behavior",10,False,,
7617,"MICRO BEHAVIOR: A process accessed a file associated with Slack containing the Slack team URL.",Unknown,,"N/A","1674498028.0","micro_behavior","Process micro behavior",10,False,,
7618,"MICRO BEHAVIOR: A process accessed a file associated with Slack containing credential information.",Unknown,,"N/A","1674498028.0","micro_behavior","Process micro behavior",10,False,,
7625,"MICRO BEHAVIOR: Binary was signed by the OS vendor",Unknown,,"N/A","1677096641.0","micro_behavior","Process micro behavior",10,False,,
7626,"MICRO BEHAVIOR: Binary was adhoc signed by the developer",Unknown,,"N/A","1677096642.0","micro_behavior","Process micro behavior",10,False,,
7627,"MICRO BEHAVIOR: Binary is unsigned",Unknown,,"N/A","1677096642.0","micro_behavior","Process micro behavior",10,False,,
7628,"MICRO BEHAVIOR: Binary was signed with a TeamId",Unknown,,"N/A","1677096642.0","micro_behavior","Process micro behavior",10,False,,
7629,"MICRO BEHAVIOR: This process sent a DNS request to a potential cloud storage domain name.",Unknown,,"N/A","1675102822.0","micro_behavior","Process micro behavior",10,False,,
7630,"MICRO BEHAVIOR: A txt or html file was written with the name containing unlock",Unknown,,"N/A","1675275920.0","micro_behavior","Process micro behavior",10,False,,
7631,"MICRO BEHAVIOR: chmod used to add execute permissions in world writable folder",Unknown,,"N/A","1675102822.0","micro_behavior","Process micro behavior",10,False,,
7632,"MICRO BEHAVIOR: kernelbase in this process was patched by a remote process. Possible hook bypass.",Unknown,,"N/A","1674238820.0","micro_behavior","Process micro behavior",10,False,,
7633,"MICRO BEHAVIOR: A thread was created suspended, then changed the entry point before resuming.",Unknown,,"N/A","1676312423.0","micro_behavior","Process micro behavior",10,False,,
7634,"MICRO BEHAVIOR: A thread was created suspended, then changed the entry point to point to attacker controlled memory before resuming. Attacker controller memory refers to allocated, shared mapping, or modified module page. Thread will be running in code that did not necessarily originate from a file on disk.",Unknown,,"N/A","1676312423.0","micro_behavior","Process micro behavior",10,False,,
7636,"MICRO BEHAVIOR: chmod used to add execute permissions to a hidden file",Unknown,,"N/A","1675102822.0","micro_behavior","Process micro behavior",10,False,,
7638,"MICRO BEHAVIOR: Outbound network connection to remote port 995 (TLS POP3).",Unknown,,"N/A","1675966828.0","micro_behavior","Process micro behavior",10,False,,
7639,"MICRO BEHAVIOR: Outbound network connection to remote port 465 (TLS SMTP).",Unknown,,"N/A","1675966828.0","micro_behavior","Process micro behavior",10,False,,
7640,"MICRO BEHAVIOR: A process associated with a binary signed by a 3rd party started (i.e. primary module was signed by a 3rd party).",Unknown,,"N/A","1677096642.0","micro_behavior","Process micro behavior",10,False,,
7641,"MICRO BEHAVIOR: Process has some network activity without having loaded winsock.",Unknown,,"N/A","1675275920.0","micro_behavior","Process micro behavior",10,False,,
7642,"MICRO BEHAVIOR: Process created with a token integrity level between untrusted to low.",Unknown,,"N/A","1676485225.0","micro_behavior","Process micro behavior",10,False,,
7643,"MICRO BEHAVIOR: Process created with a token integrity level between low to medium.",Unknown,,"N/A","1676485225.0","micro_behavior","Process micro behavior",10,False,,
7645,"MICRO BEHAVIOR: Process created with a token integrity level between medium plus to high.",Unknown,,"N/A","1676485225.0","micro_behavior","Process micro behavior",10,False,,
7644,"MICRO BEHAVIOR: Process created with a token integrity level between medium to medium plus.",Unknown,,"N/A","1676485225.0","micro_behavior","Process micro behavior",10,False,,
7646,"MICRO BEHAVIOR: Process created with a token integrity level between high to system.",Unknown,,"N/A","1676485225.0","micro_behavior","Process micro behavior",10,False,,
7647,"MICRO BEHAVIOR: Process created with a token integrity level between system to protected.",Unknown,,"N/A","1676485226.0","micro_behavior","Process micro behavior",10,False,,
7648,"MICRO BEHAVIOR: Process created with a token integrity level protected.",Unknown,,"N/A","1676485226.0","micro_behavior","Process micro behavior",10,False,,
7650,"MICRO BEHAVIOR: The process is a common shell such as sh, bash, etc. including busybox",Unknown,,"N/A","1676053226.0","micro_behavior","Process micro behavior",10,False,,
7649,"MICRO BEHAVIOR: Outbound network connection to remote port 993 (TLS IMAP).",Unknown,,"N/A","1675966828.0","micro_behavior","Process micro behavior",10,False,,
7651,"MICRO BEHAVIOR: The process wasn't analyzed by ML because the image is too large.",Unknown,,"N/A","1677096642.0","micro_behavior","Process micro behavior",10,False,,
7652,"MICRO BEHAVIOR: A region of memory was protected with PAGE_EXECUTE_READWRITE protections.",Unknown,,"N/A","1677096642.0","micro_behavior","Process micro behavior",10,False,,
7653,"MICRO BEHAVIOR: A region of memory was protected to remove executable protections.",Unknown,,"N/A","1677096642.0","micro_behavior","Process micro behavior",10,False,,
7654,"MICRO BEHAVIOR: A region of memory was protected to add writable protections. This region of memory is/was executable.",Unknown,,"N/A","1677096642.0","micro_behavior","Process micro behavior",10,False,,
7655,"MICRO BEHAVIOR: A region of memory was protected to remove writable protections. This region of memory is/was executable.",Unknown,,"N/A","1677096642.0","micro_behavior","Process micro behavior",10,False,,
7656,"MICRO BEHAVIOR: Process has loaded a second copy of the native ntdll.",Unknown,,"N/A","1677096642.0","micro_behavior","Process micro behavior",10,False,,
7657,"MICRO BEHAVIOR: Process has loaded a second copy of the wow64 ntdll.",Unknown,,"N/A","1677096642.0","micro_behavior","Process micro behavior",10,False,,
7658,"MICRO BEHAVIOR: Process opened ntdll file.",Unknown,,"N/A","1677096643.0","micro_behavior","Process micro behavior",10,False,,
7659,"MICRO BEHAVIOR: Office application loaded VBE6.dll/VBE7.dll (Virtual Basic Environment), this might indicate VBA code execution.",Unknown,,"N/A","1676398831.0","micro_behavior","Process micro behavior",10,False,,
7660,"MICRO BEHAVIOR: Office application opened a file that may have been downloaded from the Web based on the file's Mark-of-the-Web (MotW) Zone ID.",Unknown,,"N/A","1676398831.0","micro_behavior","Process micro behavior",10,False,,
7662,"MICRO BEHAVIOR: Process has loaded a second copy of the CHPE ntdll",Unknown,,"N/A","1677096643.0","micro_behavior","Process micro behavior",10,False,,
7661,"MICRO BEHAVIOR: A process opened a document type file.",Unknown,,"N/A","1677608420.0","micro_behavior","Process micro behavior",10,False,,
7663,"MICRO BEHAVIOR: Process has loaded a second copy of the ARM32 ntdll",Unknown,,"N/A","1677096643.0","micro_behavior","Process micro behavior",10,False,,
7666,"MICRO BEHAVIOR: This process loaded the windows library NapiNSP.dll.",Unknown,,"N/A","1678386621.0","micro_behavior","Process micro behavior",10,False,,
7667,"MICRO BEHAVIOR: This process loaded the windows library nlaapi.dll.",Unknown,,"N/A","1678386621.0","micro_behavior","Process micro behavior",10,False,,
7668,"MICRO BEHAVIOR: This process loaded the windows library winrnr.dll.",Unknown,,"N/A","1678386621.0","micro_behavior","Process micro behavior",10,False,,
7669,"MICRO BEHAVIOR: This process loaded the windows library credui.dll.",Unknown,,"N/A","1678386621.0","micro_behavior","Process micro behavior",10,False,,
7670,"MICRO BEHAVIOR: This process loaded the windows library winhttp.dll.",Unknown,,"N/A","1678386621.0","micro_behavior","Process micro behavior",10,False,,
7671,"MICRO BEHAVIOR: This process loaded the windows library samcli.dll.",Unknown,,"N/A","1678386621.0","micro_behavior","Process micro behavior",10,False,,
7672,"MICRO BEHAVIOR: This process loaded the windows library winmm.dll .",Unknown,,"N/A","1678386621.0","micro_behavior","Process micro behavior",10,False,,
7674,"MICRO BEHAVIOR: A process called RpcStringBindingCompose with ProtSeq ncacn_ip_tcp.",Unknown,,"N/A","1678732518.0","micro_behavior","Process micro behavior",10,False,,
7675,"MICRO BEHAVIOR: This process loaded the windows library netapi32.dll.",Unknown,,"N/A","1678386622.0","micro_behavior","Process micro behavior",10,False,,
7676,"MICRO BEHAVIOR: This process loaded the windows library activeds.dll.",Unknown,,"N/A","1678386622.0","micro_behavior","Process micro behavior",10,False,,
7677,"MICRO BEHAVIOR: This process loaded the windows library OnDemandConnRouteHelper.dll.",Unknown,,"N/A","1678386622.0","micro_behavior","Process micro behavior",10,False,,
7679,"MICRO BEHAVIOR: A non-Edge process accessed Chromium-based Edge credential store.",Unknown,,"N/A","1677782125.0","micro_behavior","Process micro behavior",10,False,,
7680,"MICRO BEHAVIOR: This process loaded the windows library GdiPlus.dll.",Unknown,,"N/A","1678386622.0","micro_behavior","Process micro behavior",10,False,,
7682,"MICRO BEHAVIOR: This process loaded the windows library WindowsCodecs.dll.",Unknown,,"N/A","1678386622.0","micro_behavior","Process micro behavior",10,False,,
7681,"MICRO BEHAVIOR: A process called RpcStringBindingCompose with ProtSeq ncacn_np.",Unknown,,"N/A","1678732518.0","micro_behavior","Process micro behavior",10,False,,
7683,"MICRO BEHAVIOR: This process loaded the windows library logoncli.dll.",Unknown,,"N/A","1678386622.0","micro_behavior","Process micro behavior",10,False,,
7686,"MICRO BEHAVIOR: A process violated Arbitrary Code Guard in audit mode.",Unknown,,"N/A","1678818631.0","micro_behavior","Process micro behavior",10,False,,
7687,"MICRO BEHAVIOR: A process violated Arbitrary Code Guard in prevention mode.",Unknown,,"N/A","1678818632.0","micro_behavior","Process micro behavior",10,False,,
7688,"MICRO BEHAVIOR: A script or executable file was written to ProgramData path",Unknown,,"N/A","1678472727.0","micro_behavior","Process micro behavior",10,False,,
7689,"MICRO BEHAVIOR: File in /var/log was truncated",Unknown,,"N/A","1678369519.0","micro_behavior","Process micro behavior",10,False,,
7690,"MICRO BEHAVIOR: A process sent a plaintext Smtp message",Unknown,,"N/A","1678732518.0","micro_behavior","Process micro behavior",10,False,,
7691,"MICRO BEHAVIOR: Process duplicate a handle to LSASS, which was run as SYSTEM, and requested PROCESS_ALL_ACCESS priviledges",Unknown,,"N/A","1678991717.0","micro_behavior","Process micro behavior",10,False,,
7692,"MICRO BEHAVIOR: Process duplicate a handle to LSASS, which was NOT run as SYSTEM, and requested PROCESS_ALL_ACCESS priviledges",Unknown,,"N/A","1678991717.0","micro_behavior","Process micro behavior",10,False,,
7693,"MICRO BEHAVIOR: Process duplicate a handle to LSASS, which was run as SYSTEM, and had a dwDesiredAccess field that did not contain PROCESS_ALL_ACCESS",Unknown,,"N/A","1678991717.0","micro_behavior","Process micro behavior",10,False,,
7695,"MICRO BEHAVIOR: Process duplicate a handle to LSASS, which was NOT run as SYSTEM, and had a dwDesiredAccess field that did not contain PROCESS_ALL_ACCESS",Unknown,,"N/A","1678991717.0","micro_behavior","Process micro behavior",10,False,,
7696,"MICRO BEHAVIOR: statfs run on the root path",Unknown,,"N/A","1679510121.0","micro_behavior","Process micro behavior",10,False,,
7697,"MICRO BEHAVIOR: A process sent an encrypted Smtp message",Unknown,,"N/A","1678732518.0","micro_behavior","Process micro behavior",10,False,,
7698,"MICRO BEHAVIOR: A process sent a plaintext Smtp message with an attachment",Unknown,,"N/A","1678732518.0","micro_behavior","Process micro behavior",10,False,,
7699,"MICRO BEHAVIOR: A process sent a SIGKILL signal to another process.",Unknown,,"N/A","1678991718.0","micro_behavior","Process micro behavior",10,False,,
7704,"MICRO BEHAVIOR: A process called AdjustTokenPrivileges and some luid SE_PRIVILEGE_ENABLED.",Unknown,,"N/A","1679941823.0","micro_behavior","Process micro behavior",10,False,,
7700,"MICRO BEHAVIOR: A process made the executable part of amsi.dll writable locally.",Unknown,,"N/A","1678818632.0","micro_behavior","Process micro behavior",10,False,,
7705,"MICRO BEHAVIOR: A process called ptrace with attach or seize",Unknown,,"N/A","1679510121.0","micro_behavior","Process micro behavior",10,False,,
7719,"Log file for one of kubernetes services was tampered or attempted to truncate.",Unknown,,"N/A","1679596521.0","micro_behavior","Process micro behavior",60,False,,
7900,"SHADOW PATTERN: Meekus High",Unknown,,"N/A","1678263657.0","shadow_pattern","Shadow pattern",70,False,,
7901,"SHADOW PATTERN: Meekus Medium",Unknown,,"N/A","1678263658.0","shadow_pattern","Shadow pattern",50,False,,
7903,"SHADOW PATTERN: Meekus Lowest",Unknown,,"N/A","1678263658.0","shadow_pattern","Shadow pattern",10,False,,
7902,"SHADOW PATTERN: Meekus Low",Unknown,,"N/A","1678263658.0","shadow_pattern","Shadow pattern",30,False,,
7904,"SHADOW PATTERN: Prewitt High",Unknown,,"N/A","1678263658.0","shadow_pattern","Shadow pattern",70,False,,
7905,"SHADOW PATTERN: Prewitt Medium",Unknown,,"N/A","1678263658.0","shadow_pattern","Shadow pattern",50,False,,
7906,"SHADOW PATTERN: Prewitt Low",Unknown,,"N/A","1678263658.0","shadow_pattern","Shadow pattern",30,False,,
7908,"SHADOW PATTERN: Maurice High",Unknown,,"N/A","1678263658.0","shadow_pattern","Shadow pattern",70,False,,
7907,"SHADOW PATTERN: Prewitt Lowest",Unknown,,"N/A","1678263658.0","shadow_pattern","Shadow pattern",10,False,,
7909,"SHADOW PATTERN: Maurice Medium",Unknown,,"N/A","1678263658.0","shadow_pattern","Shadow pattern",50,False,,
7910,"SHADOW PATTERN: Maurice Low",Unknown,,"N/A","1678263658.0","shadow_pattern","Shadow pattern",30,False,,
7911,"SHADOW PATTERN: Maurice Lowest",Unknown,,"N/A","1678263658.0","shadow_pattern","Shadow pattern",10,False,,
7912,"SHADOW PATTERN: Todd High",Unknown,,"N/A","1678263659.0","shadow_pattern","Shadow pattern",70,False,,
7913,"SHADOW PATTERN: Todd Medium",Unknown,,"N/A","1678263659.0","shadow_pattern","Shadow pattern",50,False,,
7915,"SHADOW PATTERN: Todd Lowest",Unknown,,"N/A","1678263659.0","shadow_pattern","Shadow pattern",10,False,,
7914,"SHADOW PATTERN: Todd Low",Unknown,,"N/A","1678263659.0","shadow_pattern","Shadow pattern",30,False,,
7916,"SHADOW PATTERN: Prewitt PupAdware High",Unknown,,"N/A","1678263659.0","shadow_pattern","Shadow pattern",70,False,,
7917,"SHADOW PATTERN: Prewitt PupAdware Medium",Unknown,,"N/A","1678263659.0","shadow_pattern","Shadow pattern",50,False,,
7919,"SHADOW PATTERN: Prewitt PupAdware Lowest",Unknown,,"N/A","1678263659.0","shadow_pattern","Shadow pattern",10,False,,
7918,"SHADOW PATTERN: Prewitt PupAdware Low",Unknown,,"N/A","1678263659.0","shadow_pattern","Shadow pattern",30,False,,
7920,"SHADOW PATTERN: Maurice PupAdware High",Unknown,,"N/A","1678263659.0","shadow_pattern","Shadow pattern",70,False,,
7921,"SHADOW PATTERN: Maurice PupAdware Medium",Unknown,,"N/A","1678263659.0","shadow_pattern","Shadow pattern",50,False,,
7922,"SHADOW PATTERN: Maurice PupAdware Low",Unknown,,"N/A","1678263659.0","shadow_pattern","Shadow pattern",30,False,,
7923,"SHADOW PATTERN: Maurice PupAdware Lowest",Unknown,,"N/A","1678263660.0","shadow_pattern","Shadow pattern",10,False,,
7924,"SHADOW PATTERN: Todd PupAdware High",Unknown,,"N/A","1678263660.0","shadow_pattern","Shadow pattern",70,False,,
7925,"SHADOW PATTERN: Todd PupAdware Medium",Unknown,,"N/A","1678263660.0","shadow_pattern","Shadow pattern",50,False,,
7926,"SHADOW PATTERN: Todd PupAdware Low",Unknown,,"N/A","1678263660.0","shadow_pattern","Shadow pattern",30,False,,
7928,"SHADOW PATTERN: FileBehavioralML High",Unknown,,"N/A","1678263660.0","shadow_pattern","Shadow pattern",70,False,,
7927,"SHADOW PATTERN: Todd PupAdware Lowest",Unknown,,"N/A","1678263660.0","shadow_pattern","Shadow pattern",10,False,,
7930,"SHADOW PATTERN: FileBehavioralML Low",Unknown,,"N/A","1678263660.0","shadow_pattern","Shadow pattern",30,False,,
7929,"SHADOW PATTERN: FileBehavioralML Medium",Unknown,,"N/A","1678263660.0","shadow_pattern","Shadow pattern",50,False,,
7931,"SHADOW PATTERN: FileBehavioralML Lowest",Unknown,,"N/A","1678263660.0","shadow_pattern","Shadow pattern",10,False,,
