"PatternId_decimal",description,"killchain_stage",name,objective,"pattern_updated",scenario,scenarioFriendly,severity,"show_in_ui",tactic,technique
10482,"A suspicious process identified by CrowdStrike was executed.",Unknown,,"N/A","1678263045.0","suspicious_activity","Suspicious activity",70,False,,
10483,"A suspicious process identified by CrowdStrike was executed.",Unknown,,"N/A","1678263045.0","suspicious_activity","Suspicious activity",70,False,,
10484,"A suspicious process identified by CrowdStrike was executed.",Unknown,,"N/A","1678263045.0","suspicious_activity","Suspicious activity",70,False,,
10485,"A suspicious process identified by CrowdStrike was executed.",Unknown,,"N/A","1678263362.0","suspicious_activity","Suspicious activity",70,False,,
10486,"A suspicious process identified by CrowdStrike was executed.",Unknown,,"N/A","1678263362.0","suspicious_activity","Suspicious activity",70,False,,
10487,"A suspicious process identified by CrowdStrike was executed.",Unknown,,"N/A","1678263362.0","suspicious_activity","Suspicious activity",70,False,,
10488,"A suspicious process identified by CrowdStrike was executed.",Unknown,,"N/A","1678263362.0","suspicious_activity","Suspicious activity",70,False,,
10489,"A suspicious process identified by CrowdStrike was executed.",Unknown,,"N/A","1678263362.0","suspicious_activity","Suspicious activity",70,False,,
10490,"A suspicious process identified by CrowdStrike was executed.",Unknown,,"N/A","1678263363.0","suspicious_activity","Suspicious activity",70,False,,
10491,"A suspicious process identified by CrowdStrike was executed.",Unknown,,"N/A","1678263363.0","suspicious_activity","Suspicious activity",70,False,,
10492,"A suspicious process identified by CrowdStrike was executed.",Unknown,,"N/A","1678263363.0","suspicious_activity","Suspicious activity",70,False,,
10493,"A suspicious process identified by CrowdStrike was executed.",Unknown,,"N/A","1678263363.0","suspicious_activity","Suspicious activity",70,False,,
10494,"A suspicious process identified by CrowdStrike was executed.",Unknown,,"N/A","1678263363.0","suspicious_activity","Suspicious activity",70,False,,
10495,"A suspicious process identified by CrowdStrike was executed.",Unknown,,"N/A","1678263363.0","suspicious_activity","Suspicious activity",70,False,,
10496,"A suspicious process identified by CrowdStrike was executed.",Unknown,,"N/A","1678263363.0","suspicious_activity","Suspicious activity",70,False,,
10497,"A suspicious process identified by CrowdStrike was executed.",Unknown,,"N/A","1678263363.0","suspicious_activity","Suspicious activity",70,False,,
10498,"A suspicious process identified by CrowdStrike was executed.",Unknown,,"N/A","1678263363.0","suspicious_activity","Suspicious activity",70,False,,
10499,"A process appears to be loading libraries associated with crytographic functions, which might be indicative of ransomware activity. Review the process tree.",Unknown,SensorOnlyCryptDllLoaded,"Follow Through","1625611241.0","suspicious_activity","Suspicious activity",70,False,Execution,"Shared Modules"
10500,"A process copied a suspicious file to the startup folder that might indicate a malicious persistence mechanism. Investigate the process tree and the file dropped.",Unknown,StartupFolderPersistence,"Keep Access","1626366912.0","establish_persistence","Establish Persistence",70,True,Persistence,"Boot or Logon Autostart Execution"
10501,"A suspicious LNK file was executed. Adversaries may lure users into executing malicious LNK files by disguising them as innocuous documents. Review the process tree and the LNK file.",Exploitation,SuspiciousLinkFileExecuted,"Follow Through","1623770301.0","malicious_document","Malicious document",70,True,Execution,"User Execution"
10502,"A suspicious process queried for a specific registry value.",Unknown,,"N/A","1672079425.0","suspicious_activity","Suspicious activity",70,False,,
20100,"A suspicious process identified by CrowdStrike was executed.",Unknown,ExperimentalIndicatorMac,"Falcon Detection Method","1679941557.0","suspicious_activity","Suspicious activity",50,False,"Falcon Overwatch","Suspicious Activity"
20101,"A suspicious process identified by CrowdStrike was executed.",Unknown,ExperimentalIndicatorMac2,"Falcon Detection Method","1679941558.0","suspicious_activity","Suspicious activity",50,False,"Falcon Overwatch","Suspicious Activity"
20102,"A process appears to be accessing credentials, likely in an attempt to steal passwords. If the activity is not sanctioned, your credentials may have been compromised.","Lateral motion",CredentialAccessMac,"Gain Access","1678374916.0","credential_theft","Credential theft",70,True,"Credential Access","OS Credential Dumping"
20103,"The activity appears to be related to a privilege escalation attempt. An adversary may execute additional malicious commands if the escalation was successful.",Unknown,PrivilegeEscalationMac,"Gain Access","1678374916.0","authentication_bypass","Authentication Bypass",70,True,"Privilege Escalation","Exploitation for Privilege Escalation"
20104,"The activity appears to be related to an adversary establishing persistence. The host may already be compromised and the activity should be investigated further to find the source.",Unknown,PersistenceMac,"Keep Access","1678374916.0","establish_persistence","Establish Persistence",70,True,Persistence,"External Remote Services"
20105,"An adversary appears to have attempted to exploit a vulnerability in this process. Look for follow-on activity that may indicate further malicious behaviors.",Unknown,DefenseEvasionMac,"Follow Through","1679941558.0","evade_detection","Evade Detection",70,True,Execution,"Exploitation for Client Execution"
20107,"A process appears to have been exploited to facilitate lateral movement between hosts in the environment. Both hosts should be investigated for further signs of compromise.",Unknown,LateralMovementMac,Explore,"1678374917.0","establish_persistence","Establish Persistence",70,True,"Lateral Movement","Exploitation of Remote Services"
20106,"The process appears to be involved in reconnaissance activity. Review the activity to determine if it is expected in your environment.",Unknown,DiscoveryMac,Explore,"1678374916.0","attacker_methodology","Attacker Methodology",70,True,Discovery,"System Information Discovery"
20108,"A process attempted to contact a remote command and control server. This may indicate the host is compromised.",Unknown,CommandAndControl,"Contact Controlled Systems","1678374917.0","attacker_methodology","Attacker Methodology",70,True,"Command and Control","Non-Application Layer Protocol"
20109,"A process appears to be collecting information from this host, possibly via some automated search routines. Review the activity to see if it is expected.",Unknown,CollectionMac,"Follow Through","1597969732.0","attacker_methodology","Attacker Methodology",70,True,Collection,"Automated Collection"
20111,"The commands executed on this CLI are suspicious and may be related to malicious activity. Review the commands to see if they are expected.",Unknown,ExecutionMac,"Follow Through","1623770301.0","attacker_methodology","Attacker Methodology",70,True,Execution,"Command and Scripting Interpreter"
20110,"The activity may be related to an adversary exfiltrating data from this host. Validate whether this data transfer is sanctioned.",Unknown,ExfiltrationMac,"Follow Through","1597969732.0","data_theft","Data Theft",70,True,Exfiltration,"Automated Exfiltration"
20112,"A vulnerability in this process may have been exploited. Review the surrounding activity for signs of a compromise.",Unknown,ExploitMac,"Falcon Detection Method","1623770301.0","user_compromise","User Compromise",70,True,Exploit,"Exploit Mitigation"
20113,"A suspicious process related to a likely malicious file was launched. Review any binaries involved as they may be related to malware.",Unknown,PostExploit,"Falcon Detection Method","1623770301.0","known_malware","Known malware",70,True,Malware,"Malicious File"
20114,"The process tree contains indications of a phishing attack. Likely an email opened around the time of the activity is responsible.",Unknown,SpearPhishLaunchMac,"Gain Access","1623770301.0","user_compromise","User Compromise",70,True,"Initial Access","Spearphishing Attachment"
20116,"A script or command line, often associated with exploitation kits, was executed on the system. Review the detection to determine if this activity is expected.",Unknown,ExploitKitScriptingMac,"Follow Through","1623770301.0","attacker_methodology","Attacker Methodology",70,True,Execution,"Command and Scripting Interpreter"
20115,"A script launched that appears to be related to the Empyre post exploitation agent. Empyre activity often consists of encoded python scripts. Review the script and investigate the processes involved to determine if this activity is expected.",Unknown,EmpyrePEA,"Follow Through","1663865716.0","suspicious_activity","Suspicious activity",70,True,Execution,"Command and Scripting Interpreter"
20117,"The sudo program appears to have been abused to escalate the privileges of a user in an unusual way. Review events around the sudo execution for signs of suspicious activity.",Unknown,SudoUsage,"Gain Access","1679941558.0","authentication_bypass","Authentication Bypass",70,True,"Privilege Escalation","Sudo and Sudo Caching"
20118,"Non-malicious sample detection generated for evaluation purposes.",Unknown,TestTriggerMac,"N/A","1678374917.0","suspicious_activity","Suspicious activity",30,True,,
20120,"A suspicious process identified by CrowdStrike was executed.",Unknown,FileRenamedDetectionMac,"N/A","1678374917.0","suspicious_activity","Suspicious activity",70,True,,
20119,"A suspicious process identified by CrowdStrike was executed.",Unknown,FileWrittenDetectionMac,"Falcon Detection Method","1678374917.0","suspicious_activity","Suspicious activity",70,True,Malware,"Malicious File"
20121,"A process appears to be disabling or security tools such as security software or firewall. Attackers may do this to evade detection and enable further operations. Review the process tree.",Unknown,DisableSecurityToolsDefenseEvasionMac,"Keep Access","1679941558.0","suspicious_activity","Suspicious activity",70,True,"Defense Evasion","Disable or Modify Tools"
20122,"An interactive terminal has been created for a remote host. Check the process tree to determine if malicious commands were executed and if this access was expected.",Unknown,ReverseShellMac,"Contact Controlled Systems","1625611242.0","attacker_methodology","Attacker Methodology",70,True,"Command and Control","Remote Access Software"
20123,"OpenSSL was used to decrypt a suspicious file. Adversaries may use encrypted files or information to hide artifacts of an intrusion from analysis. Please check the process tree to determine if malicious commands were executed or if this access was expected.",Unknown,OpenSSLDecryptMac,"Keep Access","1625611242.0","attacker_methodology","Attacker Methodology",70,True,"Defense Evasion","Deobfuscate/Decode Files or Information"
20124,"""A script was launched with command line arguments associated with cryptomining software. Adversaries may deploy cryptomining software to hijack system resources. Please check the process tree to determine if a malicious script was executed.",Unknown,MacScriptCryptoMining,"Follow Through","1679941558.0","known_malware","Known malware",60,True,Execution,"Command and Scripting Interpreter"
20126,"A process on your host has been linked to a suspicious hidden file or directory. Adversaries can use hidden files or directories on the system for persistence. Please check the process tree to determine if malicious commands were executed or if this is expected behavior.",Unknown,MacHiddenDirFile,"Keep Access","1678374917.0","attacker_methodology","Attacker Methodology",60,True,"Defense Evasion","Hide Artifacts"
20127,"A process associated with ransomware was detected on your host. Adversaries may deploy malware designed to encrypt files or render the system unusable until payment is made. Please review the process tree.",Unknown,MacProcRansomware,"Follow Through","1678374917.0","known_malware","Known malware",80,True,Impact,"Data Encrypted for Impact"
20125,"A webshell has been detected on your host. It may provide adversaries a set of functions to execute or a command line interface on the system. Please check the process tree to determine if malicious commands were executed or if this access was expected.",Unknown,MacWebShell,"Keep Access","1678374917.0","suspicious_activity","Suspicious activity",70,True,Persistence,"Server Software Component"
20128,"A plist file was modified. Adversaries can modify plist files to achieve privilege escalation or establish persistence. Please check the file to determine if the modifications were expected.",Unknown,MacPlistModification,"Keep Access","1678374917.0","attacker_methodology","Attacker Methodology",50,True,Persistence,"Boot or Logon Autostart Execution"
20129,"A launch agent was created or modified. Adversaries may create or modify launch agents to execute payloads automatically at startup or on a repeated interval. Please check the process tree to determine if the new launch agent is malicious.",Unknown,MacLaunchAgent,"Keep Access","1678374917.0","establish_persistence","Establish Persistence",60,True,Persistence,"Create or Modify System Process"
20130,"A launch daemon was created or modified. Adversaries may create or modify launch daemons to execute payloads automatically at startup or on a repeated interval. Please check the process tree to determine if the new launch daemon is malicious.",Unknown,MacLaunchDaemon,"Keep Access","1678374918.0","establish_persistence","Establish Persistence",70,True,Persistence,"Create or Modify System Process"
20131,"The process tree contains indications of a phishing attack. Adversaries may trick users into executing payloads by attaching them to cleverly crafted emails. Investigate the process tree to find the originating file and look for similar files delivered to other hosts.",Unknown,MacPhishing,"Gain Access","1678374918.0","user_compromise","User Compromise",80,True,"Initial Access",Phishing
20132,"A process scheduled a suspicious task. Adversaries may abuse the cron utility to perform task scheduling for initial or recurring execution of malicious code. Please check the process tree to determine if the scheduled task is malicious.",Unknown,MacScheduledTaskCron,"Keep Access","1678374918.0","establish_persistence","Establish Persistence",70,True,Persistence,"Scheduled Task/Job"
20133,"A process has modified the permissions or attributes of a file. Adversaries may modify file or directory permissions or attributes to evade access control lists (ACLs) and access protected files. Please check the process tree to determine if this modification was expected.",Unknown,MacFileDirPermissionsModification,"Keep Access","1678374918.0","authentication_bypass","Authentication Bypass",50,True,"Defense Evasion","File and Directory Permissions Modification"
20134,"A process has escalated privileges to root using a native elevation control mechanism (such as the AuthorizationExecuteWithPrivileges API). Adversaries may elevate privileges to access restricted objects or modify system state to achieve persistence. Please check the process tree to determine if this access was expected.",Installation,MacElevatedExecutionPrompt,"Gain Access","1678374918.0","privilege_escalation","Privilege escalation",60,True,"Privilege Escalation","Abuse Elevation Control Mechanism"
20135,"A process has attempted to modify the quarantine extended attribute from a downloaded file. Adversaries may modify file attributes that signify programs are from untrusted sources to subvert Gatekeeper controls. Please check the process tree to determine if this was expected behaviour.",Unknown,GatekeeperBypass,"Keep Access","1634305215.0","attacker_methodology","Attacker Methodology",70,True,"Defense Evasion","Subvert Trust Controls"
20136,"A system process contains command lines that appear to be suspicious. This might indicate an adversary abusing a system process to carry out malicious commands. If this activity is unexpected, review the command lines seen in the process tree.",Unknown,SuspiciousCommandLineTargetedMac,"Falcon Detection Method","1660151118.0","attacker_methodology","Attacker Methodology",70,True,"AI Powered IOA","Command and Scripting Interpreter"
20137,"A suspicious script launched that might be related to malicious activity. If this activity is unexpected, review the script and any related activity.",Unknown,SuspiciousScriptMac,"Falcon Detection Method","1660151118.0","suspicious_activity","Suspicious activity",70,False,"AI Powered IOA","Command and Scripting Interpreter"
20139,"A process modified critical file /etc/ssh/sshd_config. Investigate the process tree.",Unknown,EtcSshdConfModifiedMac,"Keep Access","1634893515.0","attacker_methodology","Attacker Methodology",70,True,Persistence,"Valid Accounts"
20138,"A system process contains command lines that appears to be suspicious. This might indicate an adversary abusing a system process to carry out malicious commands. If this activity is unexpected, review the command lines seen in the process tree.",Unknown,SuspiciousCommandLineMac,"Falcon Detection Method","1660151118.0","attacker_methodology","Attacker Methodology",70,True,"AI Powered IOA","Command and Scripting Interpreter"
20140,"A process modified critical file /etc/passwd. Investigate the process tree.",Unknown,EtcPasswdModifiedMac,"Keep Access","1634893515.0","attacker_methodology","Attacker Methodology",70,True,Persistence,"Valid Accounts"
20142,"A process deleted files associated with its activity. Adversaries may delete files left behind by their intrusion. Review the accessed files and process tree.",Unknown,GenFileDeletionMac,"N/A","1634893815.0","attacker_methodology","Attacker Methodology",70,True,,
20141,"A process modified critical file /etc/sudoers. Investigate the process tree.",Unknown,EtcSudoersModifiedMac,"Gain Access","1634893815.0","attacker_methodology","Attacker Methodology",70,True,"Privilege Escalation","Sudo and Sudo Caching"
20143,"A process accessed data from the local file system. This might indicate an attempt to steal information. Review the accessed files and process tree.",Unknown,GenDataFromLocalSystemCollectionMac,"Follow Through","1634893815.0","attacker_methodology","Attacker Methodology",70,True,Collection,"Data from Local System"
20144,"A process attempted to disable the Falcon sensor. This is indicative of an attempt to tamper with Falcon sensor. Investigate the file system operation and process tree.",Unknown,MacFalconSensorTamper,"Keep Access","1678375215.0","attacker_methodology","Attacker Methodology",70,True,"Defense Evasion","Disable or Modify Tools"
20145,"A process attempted to modify files used for Falcon sensor dynamic configuration. This is indicative of an attempt to tamper with Falcon sensor. Investigate the file system operation and process tree.",Unknown,MacFalconSensorConfigTamper,"Keep Access","1678375215.0","attacker_methodology","Attacker Methodology",70,True,"Defense Evasion","Disable or Modify Tools"
20147,"A process attempted to uninstall the Falcon sensor. This is indicative of an attempt to tamper with Falcon sensor. Investigate the file system operation and process tree.",Unknown,MacFalconSensorUninstall,"Keep Access","1678375215.0","attacker_methodology","Attacker Methodology",70,True,"Defense Evasion","Disable or Modify Tools"
20146,"A process attempted to modify a Falcon sensor folder. This is indicative of an attempt to tamper with Falcon sensor. Investigate the file system operation and process tree.",Unknown,MacFalconSensorFoldersTamper,"Keep Access","1678375215.0","attacker_methodology","Attacker Methodology",70,True,"Defense Evasion","Disable or Modify Tools"
20148,"An attempt to kill a falcon sensor process has been observed. This is indicative of an attempt to tamper with Falcon sensor. Investigate the file system operation and process tree.",Unknown,MacFalconSensorKillProcess,"Keep Access","1678375215.0","attacker_methodology","Attacker Methodology",70,True,"Defense Evasion","Disable or Modify Tools"
20149,"A process associated with adware was detected on your host. Please review the process tree.",Unknown,MacAdware,"Follow Through","1678374918.0","attacker_methodology","Attacker Methodology",70,True,Execution,"Malicious File"
20150,"The commands executed are suspicious and may be related to malicious network scanning activity. Adversaries may attempt to get a listing of services running on remote hosts. Review the commands to see if they are expected",Unknown,MacNetworkServiceScanning,Explore,"1679941558.0","attacker_methodology","Attacker Methodology",70,True,Discovery,"Network Service Scanning"
20151,"A process has written a known EICAR test file. Review the files written by the triggered process.",Unknown,EICARTestFileWrittenMac,"Follow Through","1650392523.0","attacker_methodology","Attacker Methodology",10,True,Execution,"User Execution"
20153,"This session contains events associated with exploitation to facilitate lateral movement between hosts in the environment. Adversaries might be pivoting through multiple systems and accounts to gain their objective. Both hosts should be investigated for further signs of compromise.",Unknown,GenLateralMovementMacSession,Explore,"1662975917.0","attacker_methodology","Attacker Methodology",70,True,"Lateral Movement","Exploitation of Remote Services"
20152,"A process has written a known malicious file. Review the files written by the triggered process.",Unknown,MaliciousFileWritten,"Follow Through","1649182630.0","attacker_methodology","Attacker Methodology",70,True,Execution,"User Execution"
20154,"A likely malicious file was launched within this session. Review any binaries involved as they may be related to malware.",Unknown,GenPostExploitMacSession,"Falcon Detection Method","1679941558.0","attacker_methodology","Attacker Methodology",70,True,Malware,"Malicious File"
20155,"A webshell has been detected running on your host in this session. It may provide adversaries a set of functions to execute or a command-line interface on the system. Please check the entire session to determine if malicious commands were executed or if this access was expected.",Unknown,WebshellMacSession,"Keep Access","1662975917.0","suspicious_activity","Suspicious activity",70,True,Persistence,"Web Shell"
20157,"Multiple reconnaissance commands have been executed in this session. Adversaries might be trying to gather information they can use to plan future operation. Review the activity to determine if it is expected in your environment.",Unknown,GenDiscoveryMacSession,Explore,"1662975918.0","attacker_methodology","Attacker Methodology",70,True,Discovery,"System Information Discovery"
20156,"The activity in this session appears to be related to an adversary establishing persistence. The host may already be compromised and the activity should be investigated further to find the source.",Unknown,GenPersistenceMacSession,"Keep Access","1662975918.0","attacker_methodology","Attacker Methodology",70,True,Persistence,"External Remote Services"
20158,"A defense evasion technique has been detected in this session. Adversaries can make changes to your hosts in order to evade detection or impair investigation. Review the processes executed in this session.",Unknown,GenDefenseEvasionMacSession,"Follow Through","1662976216.0","attacker_methodology","Attacker Methodology",70,True,Execution,"Exploitation for Client Execution"
20159,"A suspicious process identified by CrowdStrike was executed.",Unknown,KeychainDump,"Gain Access","1679941558.0","attacker_methodology","Attacker Methodology",70,True,"Credential Access",Keychain
20160,"Malicious activity was identified by OverWatch.",Unknown,OverWatchIndicatorMac,"Falcon Detection Method","1659032494.0","overwatch_detection","Falcon Overwatch detection",50,False,"Falcon Overwatch","Malicious Activity"
20161,"A process attempted to connect to a suspicious URL. This could be indicative of a malicious download attempt. If this activity is unexpected, review the process tree, associated URL, and any related activity.",Unknown,SuspiciousURLDownloadMac,"Falcon Detection Method","1665689417.0","attacker_methodology","Attacker Methodology",70,True,"AI Powered IOA","User Execution"
20162,"A suspicious process was identified by CrowdStrike. Review the process tree.",Unknown,"Testing activity (Mac)","Follow Through","1667414416.0","attacker_methodology","Attacker Methodology",10,True,Execution,"User Execution"
20163,"A process launched with indications of dynamic linker hijacking via environment variables. Please review the process tree.",Unknown,"Dynamic Linker Hijacking","Keep Access","1669152350.0","attacker_methodology","Attacker Methodology",70,True,"Defense Evasion","Dynamic Linker Hijacking"
20164,"A process launched with suspicious environment variables. Please review the process tree.",Unknown,"Suspicious Environment Variable","Keep Access","1669152350.0","attacker_methodology","Attacker Methodology",70,True,"Defense Evasion","Dynamic Linker Hijacking"
20165,"Adversaries may abuse resource forks to hide malicious code or executables to evade detection and bypass security applications. Review the process tree and associated commands.",Unknown,"Hide Artifacts: Resource Forking","Keep Access","1676473220.0","attacker_methodology","Attacker Methodology",70,True,"Defense Evasion","Resource Forking"
20166,"A process appears to be disabling or evading security tools or logging. Attackers may do this to evade detection and enable further operations. Review the process tree.",Unknown,GenericDefenseDisablingMac,"Keep Access","1677175972.0","attacker_methodology","Attacker Methodology",70,True,"Defense Evasion","Clear Linux or Mac System Logs"
